{
  "schema": "agent-security-audit",
  "schema_version": "2.0",
  "meta": {
    "tool": "mcp-audit",
    "engine_version": "2.0.0",
    "schema_version": "2.0",
    "ruleset_version": "2.0.0",
    "generated_at": 1788611621.9213355,
    "manifest": {
      "path": "/home/user/aith_redteaming/examples/mcp_config.example.json",
      "schema_version": "2.0",
      "legacy_wrapped": true,
      "adapters": [
        {
          "id": "mcp-config",
          "kind": "mcp_inventory"
        }
      ]
    },
    "profile": null,
    "reproducibility": {},
    "reporting": {},
    "canonicalization_version": "2",
    "mode": "offline",
    "access_profile": "grey_box",
    "run_id": "run-2425feb6f6e7",
    "target": {
      "id": "legacy-mcp-config",
      "build_ref": null,
      "environment": "unknown",
      "note": "legacy MCP config wrapped into a v2 manifest; target identity/build not declared (pass target_id to set one)"
    },
    "runtime_validation_performed": false,
    "status": "partial",
    "started_at": 1788611621.9213336,
    "finished_at": 1788611621.925412
  },
  "target": {
    "id": "legacy-mcp-config",
    "build_ref": null,
    "environment": "unknown",
    "note": "legacy MCP config wrapped into a v2 manifest; target identity/build not declared (pass target_id to set one)"
  },
  "adapters": [
    {
      "adapter_id": "mcp-config",
      "kind": "mcp_inventory",
      "adapter_version": "2.0.0",
      "status": "available",
      "supported": [
        "configured_inventory",
        "snapshot_inventory",
        "live_inventory(stdio,http,sse)",
        "resources_list",
        "prompts_list",
        "server_instructions",
        "agent_context_files"
      ],
      "unsupported": {
        "role_enumeration": "a handshake shows the catalogue for one identity only",
        "runtime_observed": "runtime usage comes from the trace adapter",
        "policy_authorized": "authorized tool lists come from the policy adapter"
      },
      "reasons": [],
      "binding": {
        "path": "/home/user/aith_redteaming/examples/mcp_config.example.json"
      },
      "captured_at": 1788611621.9223423,
      "evidence_count": 5
    }
  ],
  "plan": {
    "ruleset_version": "2.0.0",
    "available_sources": [
      "mcp_inventory"
    ],
    "required_controls": [
      "MEM-01",
      "MEM-02",
      "MEM-03",
      "MEM-04",
      "MEM-05",
      "MEM-06",
      "MEM-07",
      "MEM-08",
      "MEM-09",
      "MEM-10",
      "AUTH-01",
      "AUTH-02",
      "AUTH-03",
      "AUTH-04",
      "AUTH-05",
      "AUTH-06",
      "INFRA-01",
      "INFRA-02",
      "INFRA-03",
      "TOOL-01",
      "TOOL-02",
      "TOOL-03",
      "TOOL-04",
      "TOOL-05",
      "EGRESS-01",
      "EGRESS-02",
      "INV-01",
      "INV-02"
    ],
    "entries": [
      {
        "rule_id": "MEM-01",
        "version": "2.0.0",
        "stage": "B",
        "domain": "memory",
        "status": "not_evaluated",
        "missing_sources": [
          "source_snapshot"
        ],
        "required_sources": [
          [
            "source_snapshot"
          ],
          [
            "policy_snapshot",
            "memory_event_snapshot"
          ],
          [
            "trace"
          ],
          [
            "control_fixtures"
          ]
        ]
      },
      {
        "rule_id": "MEM-02",
        "version": "2.0.0",
        "stage": "B",
        "domain": "memory",
        "status": "not_evaluated",
        "missing_sources": [
          "source_snapshot"
        ],
        "required_sources": [
          [
            "source_snapshot"
          ],
          [
            "policy_snapshot",
            "source_snapshot"
          ],
          [
            "memory_event_snapshot"
          ]
        ]
      },
      {
        "rule_id": "MEM-03",
        "version": "2.0.0",
        "stage": "B",
        "domain": "memory",
        "status": "not_evaluated",
        "missing_sources": [
          "source_snapshot"
        ],
        "required_sources": [
          [
            "source_snapshot"
          ],
          [
            "memory_event_snapshot"
          ]
        ]
      },
      {
        "rule_id": "MEM-04",
        "version": "2.0.0",
        "stage": "B",
        "domain": "memory",
        "status": "not_evaluated",
        "missing_sources": [
          "source_snapshot"
        ],
        "required_sources": [
          [
            "source_snapshot"
          ],
          [
            "trace"
          ]
        ]
      },
      {
        "rule_id": "MEM-05",
        "version": "2.0.0",
        "stage": "B",
        "domain": "memory",
        "status": "not_evaluated",
        "missing_sources": [
          "source_snapshot"
        ],
        "required_sources": [
          [
            "source_snapshot"
          ],
          [
            "memory_event_snapshot"
          ]
        ]
      },
      {
        "rule_id": "MEM-06",
        "version": "2.0.0",
        "stage": "B",
        "domain": "memory",
        "status": "not_evaluated",
        "missing_sources": [
          "source_snapshot"
        ],
        "required_sources": [
          [
            "source_snapshot"
          ],
          [
            "memory_event_snapshot"
          ]
        ]
      },
      {
        "rule_id": "MEM-07",
        "version": "2.0.0",
        "stage": "B",
        "domain": "memory",
        "status": "not_evaluated",
        "missing_sources": [
          "source_snapshot"
        ],
        "required_sources": [
          [
            "source_snapshot"
          ],
          [
            "memory_event_snapshot"
          ],
          [
            "trace"
          ]
        ]
      },
      {
        "rule_id": "MEM-08",
        "version": "2.0.0",
        "stage": "D",
        "domain": "memory",
        "status": "not_evaluated",
        "missing_sources": [
          "memory_event_snapshot"
        ],
        "required_sources": [
          [
            "memory_event_snapshot"
          ],
          [
            "control_fixtures"
          ],
          [
            "policy_snapshot"
          ]
        ]
      },
      {
        "rule_id": "MEM-09",
        "version": "2.0.0",
        "stage": "D",
        "domain": "memory",
        "status": "not_evaluated",
        "missing_sources": [
          "source_snapshot"
        ],
        "required_sources": [
          [
            "source_snapshot"
          ],
          [
            "trace"
          ]
        ]
      },
      {
        "rule_id": "MEM-10",
        "version": "2.0.0",
        "stage": "D",
        "domain": "memory",
        "status": "not_evaluated",
        "missing_sources": [
          "policy_snapshot",
          "source_snapshot"
        ],
        "required_sources": [
          [
            "policy_snapshot",
            "source_snapshot"
          ]
        ]
      },
      {
        "rule_id": "AUTH-01",
        "version": "2.0.0",
        "stage": "B",
        "domain": "identity",
        "status": "not_evaluated",
        "missing_sources": [
          "source_snapshot"
        ],
        "required_sources": [
          [
            "source_snapshot"
          ],
          [
            "policy_snapshot",
            "source_snapshot"
          ]
        ]
      },
      {
        "rule_id": "AUTH-02",
        "version": "2.0.0",
        "stage": "B",
        "domain": "identity",
        "status": "not_evaluated",
        "missing_sources": [
          "source_snapshot"
        ],
        "required_sources": [
          [
            "source_snapshot"
          ],
          [
            "control_fixtures"
          ],
          [
            "trace"
          ]
        ]
      },
      {
        "rule_id": "AUTH-03",
        "version": "2.0.0",
        "stage": "B",
        "domain": "identity",
        "status": "not_evaluated",
        "missing_sources": [
          "source_snapshot"
        ],
        "required_sources": [
          [
            "source_snapshot"
          ]
        ]
      },
      {
        "rule_id": "AUTH-04",
        "version": "2.0.0",
        "stage": "B",
        "domain": "identity",
        "status": "not_evaluated",
        "missing_sources": [
          "source_snapshot"
        ],
        "required_sources": [
          [
            "source_snapshot"
          ],
          [
            "policy_snapshot",
            "source_snapshot"
          ]
        ]
      },
      {
        "rule_id": "AUTH-05",
        "version": "2.0.0",
        "stage": "B",
        "domain": "identity",
        "status": "not_evaluated",
        "missing_sources": [
          "source_snapshot"
        ],
        "required_sources": [
          [
            "source_snapshot"
          ]
        ]
      },
      {
        "rule_id": "AUTH-06",
        "version": "2.0.0",
        "stage": "D",
        "domain": "identity",
        "status": "not_evaluated",
        "missing_sources": [
          "source_snapshot"
        ],
        "required_sources": [
          [
            "source_snapshot"
          ],
          [
            "trace"
          ]
        ]
      },
      {
        "rule_id": "INFRA-01",
        "version": "2.0.0",
        "stage": "B",
        "domain": "infrastructure",
        "status": "not_evaluated",
        "missing_sources": [
          "deployment"
        ],
        "required_sources": [
          [
            "source_snapshot",
            "policy_snapshot"
          ],
          [
            "deployment"
          ]
        ]
      },
      {
        "rule_id": "INFRA-02",
        "version": "2.0.0",
        "stage": "B",
        "domain": "infrastructure",
        "status": "not_evaluated",
        "missing_sources": [
          "deployment"
        ],
        "required_sources": [
          [
            "deployment"
          ]
        ]
      },
      {
        "rule_id": "INFRA-03",
        "version": "2.0.0",